# GH ISSUE TITLE,"# BODY STRING  (SUB-ISSUES, semi-colon delimited)",# TOTAL SUB-ISSUES,# CREATED,# COMPLETED,# PRIORITY,# LABEL1,# LABEL2,# LABEL3 - LABELn (semi-colon delimited)
incomplete website SEO?,,,03/31/2025,04/28/2025,Medium,For Longevity sake,planner1,
Intaker = poor mobile experience?,,,03/31/2025,04/22/2025,Medium,For Longevity sake,planner1,
wix mobile - zooming issue,,,03/31/2025,04/28/2025,Important,For Longevity sake,planner1,
FIX META BIZ SUITE??? ,,,04/07/2025,04/15/2025,Medium,GOOGLE ANALYTICS,planner1,
intaker install > wix site,"goals > conversions > summary > settings > google analytics property ;conversion id, destination id - AW-11030537154",2,04/18/2025,04/22/2025,Medium,GOOGLE ANALYTICS,planner1,
stella docusign email notifs,law4veterans.com/#burn;check Troy's ads for URLs;tags support says: change conversion goals away from default & point at website instead of e.g. UA,3,03/31/2025,04/20/2025,Medium,GOOGLE ANALYTICS,planner1,
terrible mobile UX,cannot link to ads acoount without admin rights,1,03/31/2025,04/22/2025,Medium,GOOGLE ANALYTICS,planner1,
test,,,04/18/2025,04/22/2025,Medium,GOOGLE ANALYTICS,planner1,
🐊 NOTES: intaker readme,,,04/18/2025,04/22/2025,Medium,GOOGLE ANALYTICS,planner1,
Connect Meta Verified Support ,L4V tag mgr container - GTM-54HN8L4T ;G-0HGTJKFYN0... wix google tag integration;Law4Veterans Google Tag Mgr - 629 129 990 6;L4V GAnanlytics Account - 346 616 544,4,04/08/2025,04/14/2025,Medium,google conversion tags,planner1,
"instagram, intro triple postsss",REQUIRES: ads campaign admin access;edit individual campaign's settings for analytics referrals (tag settings) ;determine which campaigns troy wants linked to what website actions,3,03/31/2025,04/08/2025,Urgent,google conversion tags,planner1,
Joe Headshots,,,04/06/2025,04/07/2025,Medium,google conversion tags,planner1,
l4v logos,"conversion ID 11030537154... found in G.ads > goals > campaign action settings > tag options  ;Troy owns google ads account;OLDER > ""Law4Veterans.com. Joseph M. Bochicchio, PLLC (UA-249921957-17)"";??? owns google analytics property ""Law4Veterans.com. Joseph M. Bochicchio, PLLC - GA4 (401830982)""",4,04/06/2025,04/07/2025,Medium,google conversion tags,planner1,
photo export settings:  instagram (+facebook crosspost),Conversion Action ... Set conversion value ??;TRACKING TEMPLATE to BLANK???;GIVE ADMIN?: cannot link to g.analytics account;enable parallel tracking;account setting > lead  form ads terms NOT accepted,5,04/06/2025,04/07/2025,Medium,google conversion tags,planner1,
Stella msft teams license ,,,04/03/2025,04/15/2025,Medium,google conversion tags,planner1,
brianbakerdigital did NOT receive Form completion notification,,,03/31/2025,03/31/2025,Medium,INTAKER INTALL 2K25 HAPPY EASTER ,planner1,WIX SHIT;intaker
choose: Wix chat vs Intaker,"2) or use domain rules (/bots/publish) ??? ... not sure if code injection still required;1) inject header code into Wix ... https://dashboard.intaker.com/bots/publish ;remove wix chat, GOOD RIDDANCE MFFFFFFFF;audit / fix intaker+wix mobile website;use Intaker HTML button code?? ... sucked ass when I tried last",5,03/31/2025,03/31/2025,Medium,INTAKER INTALL 2K25 HAPPY EASTER ,planner1,WIX SHIT;intaker
Docusign renewal - APRIL 22,"add instructions re: how Leads submit Letters... email, scan,....?? ;""Text us widget"" ... joe says ""sure, just not my cell. do later;BOT (v3.0), WORKING VERSION >>>  https://www.intaker.com/law4veterans/L4Vv3.0;""contacts widgets"" ... unknown. likely cannot claim current L4V 1-866-num from Twilio ;remove ALL emojis (default responses) ;edit popup text in ""mini widget"" and ""pop up"" > worded so we aren't initiating contact;future research: sequences, workflows, integrations, analytics, Leads (2022-2025)  .... ;---;INSTALL ON WEBSITE, replace wix chat;complete ""landing page"" ... low priority. pic? colors?...  link to Ads/tag mgr eventually;future tasks: update Organization profile;apply remaining joe edits??? shared reply-to inbox? etc. ",12,03/31/2025,,Urgent,INTAKER INTALL 2K25 HAPPY EASTER ,planner1,URGENT;intaker
fix contact form (joe cannot submit) ,"settings menus have no logic == look thru every setting to change any one thing,  lol . . . ;must request ""script"" changes via support (email);open every drop-down for ""advanced settings"" == most of the bot features ;working version is ""L4V v3.0""",4,03/31/2025,03/31/2025,Medium,INTAKER INTALL 2K25 HAPPY EASTER ,planner1,intaker
Hire help,https://americanmedicalexperts.com/,1,04/01/2025,,Urgent,INTAKER INTALL 2K25 HAPPY EASTER ,planner1,
L4v ad campaign calendar,"assign Leads within Intaker?  (> research Docusign integration) ;spam prevention? = 2fa sms to submit again;or Joe simply fwd Intaker email regardless?;use intaker phonecall button or intaker phone service? ;live-call connect? intaker instantly dials Firm upon Lead phone # submission;do we need Firm users saved in Intaker? Stella, Debbie, etc. ",6,04/04/2025,,Urgent,INTAKER INTALL 2K25 HAPPY EASTER ,planner1,intaker
Simple Law renewal???,,,04/01/2025,,Low,INTAKER INTALL 2K25 HAPPY EASTER ,planner1,intaker
wix FAQ topics,"[🐊 wanted Lead as reply-to, so Joe decides email contact... use pass-thru inbox, solve 2x probs];LEAD'S EMAIL > how to get/send decision letter;Feb17: consultations@, bcc debbie, stella, joe;[🐊 Intaker Lead info fields is set at the chatbot level, for all chat flows;""don’t care if we use Wix or Intaker ultimately… I just want it all to work"";FAQ on the chatbot;edit any ""free consultation with *joe*"" ,, stella/debbie also do consults;""WIX dashboard is more difficult to use, and we were having trouble getting fill in forms"";""use Intaker for leads, and WIX for mobile website leads?"";""I agree that if [chatbot mssg is] coming to me, they are only communicating with a lawyer"";put debbie@ for RD recipient;LEAD's EMAIL >> “please send us a copy of the RD”…. where would they send it to? ;CHANGE >>  ""can i help you?"" popup = lawyers initiating contact = unethical   ;set LEAD EMAIL reply-to = joe@l4v ... Lead can send RD via replying to email ;personalize ""chatbot"" icons with Joe's pic, name >> edit chat copy to first person? ",15,04/20/2025,,Important,INTAKER INTALL 2K25 HAPPY EASTER ,planner1,Joe;intaker
ADMIN for g.ads,"Brian says: actually writing seo tags, etc., must happen before improvement planning.;Excellent resource is Yoast (check for wix plugin?);Probably excellent resource is Wix seo checklist/wizard",3,04/22/2025,,Medium,Isa,planner1,
GAds / Wix conversion tracker,https://ptsdlawyers.com/board-of-veterans-appeals/,1,04/15/2025,,Urgent,Isa,planner1,
audit SEO of old websites,"re-do silhouette logo using joe's outline;"".com""  logo ending?",2,03/31/2025,,Medium,JOE'S REQs & REQs [REQUESTS+REQUIREMENTS],planner1,
Joe's Meta 2fa (debbie mail),remove dates from google reviews?,1,03/31/2025,,Medium,JOE'S REQs & REQs [REQUESTS+REQUIREMENTS],planner1,
refresh L4v /Joe logos,"love original american flag + dogtag logo ;love ""go with joe"" logo > change graphic to joe's silhouette > headshot + photoshop > indesign? ",2,04/06/2025,,Medium,JOE'S REQs & REQs [REQUESTS+REQUIREMENTS],planner1,Joe
Complete account setup,,,04/17/2025,,Medium,"L4v ""databases"" [DB] ",planner1,
email campaigns,"""established"" dates;Biz entities: jmb pllc;accolades, bona fides;DBA?",4,03/31/2025,,Important,"L4v ""databases"" [DB] ",planner1,[databases]
google partner????? FK troy,"points of contact (phones, emails);licenses, memberships, bonafides;hashtags;(disentangle DLH~L4V);review website profiles - google biz, avvo, trust pilot, etc;competitors/inspo;ad copy usage rules;accolades;digital asset map (photos, logos, media packet,);social media profiles ",10,05/10/2025,,Medium,"L4v ""databases"" [DB] ",planner1,[databases]
Notes for Website,shared docusign inbox?;create report / spreadsheet (copilot?);marketing@;admin@,4,04/20/2025,,Medium,"L4v ""databases"" [DB] ",planner1,
When do I ask for Joe's input? ,Intaker OG (bold blue): 498fe1;Canva 1 (LT blue):  7dc1ff;Canva 2 (DK blue): 6995b5 ,3,04/08/2025,,Medium,"L4v ""databases"" [DB] ",planner1,social media;[databases];L4V Branding
wix certs,"spreadsheet: client, date of contact/appeal/ruling, injury/claim, geo locale, $award (+fee);Generate using copilot + prevail files?;SEE JOE's SPREADSHEET (in bbdigital email) - (2022-24?)",3,03/31/2025,,Medium,"L4v ""databases"" [DB] ",planner1,[databases]
CAPTIONS,how the fuck do containers work;customize org links / assets / socials icons??,2,04/07/2025,,Medium,"l4v website, low priority",planner1,
Code to auto adjust size,can dynamic collection display like i want;dynamic collection FAQ in place of blog?  SEO implications?,2,04/29/2025,,Medium,"l4v website, low priority",planner1,
google search console,https://www.nclawspecialists.gov/for-lawyers/for-certified-specialists/media-kit/;https://www.nclamp.gov/;https://www.americanbar.org/groups/specialization/organizations-with-aba-accredited-lawyer-certifica;https://www.nclamp.gov/for-military-personnel-family/finding-a-lawyer/;https://www.ncbar.gov/media/730802/legal-resource-finder.jpg,5,03/31/2025,,Medium,"l4v website, low priority",planner1,
Joe requests,,,04/04/2025,,Medium,"l4v website, low priority",planner1,
L4V CASE HISTORY,google reviews/business;avvo?;linked in;put them in the footer... == google reviews on every page,4,04/04/2025,,Medium,"l4v website, low priority",planner1,
L4v phone numbers - public facing,,,04/01/2025,,Medium,"l4v website, low priority",planner1,
media export settings for Wix uploads,"audit additional pages, URLs;determine useful website versions and their dates;save URL of each;(ChatGPT) old copy + SEO keyword analysis = new copy ;scrape copy and save to... OneNote?",5,05/06/2025,,Medium,"l4v website, low priority",planner1,
Upload Media Assets to File Manager on Meta,https://dev.wix.com/docs/develop-websites/articles/workspace-tools/developer-tools/triggered-emails/;triggered emails vs wix automations. same thing?,2,04/08/2025,,Medium,"l4v website, low priority",planner1,
Brian owned,wayback > site map;new copy = old copy + SEO keywords ;scrape w/GPT,3,04/16/2025,,Medium,L4V x Wayback Archive,planner1,
JOE BRANDING REQUESTS ,,,04/18/2025,,Important,L4V x Wayback Archive,planner1,
L4V branding kits,"anchor links;copy content, as pertaining to SEO ;URL slugs;SEO tags? ;previous homepage was stuffed with SEO and anchor links",5,04/07/2025,,Medium,L4V x Wayback Archive,planner1,
Phone numbers,[INSERT ARCHIVE LINK],1,04/06/2025,,Medium,L4V x Wayback Archive,planner1,
SEO,,,03/31/2025,,Medium,L4V x Wayback Archive,planner1,
Should we be using landing pages? Are they already in use?,,,03/31/2025,,Medium,L4V x Wayback Archive,planner1,
"""vibe"" streaming service commercials",when?;August;Ditch simple law? Lol,3,04/14/2025,,Medium,low priority,planner1,
??????? wix,https://www.reddit.com/r/SEO/comments/hrcbv9/wix_seo_issues/;https://www.reddit.com/r/WixHelp/comments/18oazro/meta_descripton_business_what_am_i_missing/;https://www.wix.com/seo/learn/resource/what-is-google-search-console#viewer-5ybih31321,3,04/04/2025,,Medium,low priority,planner1,
clean up L4V/DLH msft project files,UTM ;configure site tags: analytics>L4V account>property settings>data streams,2,04/01/2025,,Low,low priority,planner1,
google analytics,NC Bar does not care;https://www.ncbar.gov/for-lawyers/ethics/adopted-opinions/2005-formal-ethics-opinion-8/;must register DBA in at least 1 county ;trademark search https://tmsearch.uspto.gov/search/search-information;nc dba form: https://edpnc.com/wp-content/uploads/2024/03/A-Assumed-Business-Name-Certificate-1.pdf;meck county dba: https://meckrod.manatron.com/localization/asninfo.htm,6,03/31/2025,,Medium,low priority,planner1,
"Misc usage, ethics",price check Canva;separate all from guga's account?;any good alts? don't think so ,3,04/01/2025,,Medium,low priority,planner1,
PENDING RESPONSE,"stella@law4veterans.com seems to be a default recipient in the notification flow;CAN STELLA JUST HIT ""UNSUBSCRIBE"" LINK ???? (mostly no);debbie@, stella@ both trigger email to stella@ when they send envelope to client;unclear if joe@ also triggers;evaluate fix;what does ""report email"" hyperlink do? ",6,04/08/2025,,Medium,low priority,planner1,
RESEARCH,BIMI? https://support.google.com/a/answer/10911028?dark=1&sjid=17664652614073739543-NA,1,04/10/2025,,Medium,low priority,planner1,
Speed Optimization Analysis,canva;misc meta business shits,2,04/10/2025,,Medium,low priority,planner1,
"Update dns domain tags with MS, Wix, DS","fonts, styles, colors;wix;adobe;canva",4,04/22/2025,,Medium,low priority,planner1,
"VA language, official usage",https://www.wix.com/learn/certification/accessibility;https://www.wix.com/studio/academy/web-designer-certification-criteria,2,04/07/2025,,Medium,low priority,planner1,
Wix form (soon intaker chat) - Lead notif email,"delete Planner stubs, archive old;start in Sharepoint? ",2,04/08/2025,,Urgent,low priority,planner1,
Wix Form spam ,1: added L4v domain via search console panel ;TWO properties?? ;https://www.wix.com/seo/learn/resource/wix-site-inspection-tool;reddit says: check html header for old tag data;2: added google tag via wix marketing integrations,5,04/08/2025,,Urgent,low priority,planner1,
"[DB] BRAND COLORS ... hexcolors, etc.",,,04/18/2025,,Medium,MAJOR TASKS,planner1,
"custom ""socials bar"" ","704-318-4777 - https://www.instagram.com/p/ChKYdh0Or8D/;(704-940-0353 - Troy's default);(704-543-2294) ;intaker > settings > ""intaker phone number""  (704) 389-9901 ... fwds to (704) 940-0353",4,04/04/2025,,Medium,MAJOR TASKS,planner1,[databases];phone numbers #
"database for L4V usage rules, technicals, ethics","trace numbers to campaigns (/platforms?);wait for Troy's report (email) ;Troy: defaulting 704-940-0353 (joe says ""that's one of my actual land line numbers"");(product) research > phone # generator +analytics ;see @isa notes for #s;bbb.org: (704) 940-0353;Troy : all L4v-800 numbers untrackable;DATABASE: L4v #s, attached channel,;attach (unique?) #s to every profile > IG, FB, website, ads ",9,04/04/2025,,Medium,MAJOR TASKS,planner1,phone numbers #
LATER /intaker side projects,,,04/18/2025,,Low,MAJOR TASKS,planner1,intaker
Legal Taxonomy resource for VA terms,holiday + military holiday;newsletter;dropped/silent Leads;client birthday > simplelaw??? outlook?,4,04/07/2025,,Medium,MAJOR TASKS,planner1,
May Social Media Post ideas,,,04/28/2025,,Medium,MAJOR TASKS,planner1,
to do ,logos;colors: ;wordmark ,3,04/16/2025,,Medium,MAJOR TASKS,planner1,
[DB] BRANDING PACKET /LIBRARY ,"update theme... fonts + sizes, colors;create wix asset Boards (org assets) ",2,04/18/2025,,Medium,No Bucket,planner1,
ad blocker incompatible?,"Big l4v logo file (1:1 square, 10mb) for Google Biz Profile pic",1,03/31/2025,,Medium,No Bucket,planner1,
Create a link with Google Ads,https://enterprisemarketingportal.google/become-a-partner,1,04/17/2025,,Medium,No Bucket,planner1,
Facebook ,") logos and branding;)) check ""asset map"" task within this planner for others;) headshots ;can they all go in a single board? then subdivide accordingly ;what is ideal file settings: size, resolution, etc.;write SEO filenames before upload to wix???  or upload naked files, then update in wix?;) large assets, heros, backgrounds (jeep... etc.) ",7,03/31/2025,,Medium,No Bucket,planner1,
https://www.youtube.com/@Law4Veterans,(review in progress....) ;great menu /banner. especially phone number,2,03/31/2025,,Medium,No Bucket,planner1,
Jessica's website,fonts + sizes according to SEO Hierarchy (H1-P3) ... already done? ;colors;have NOT deployed or tested Theme on live site;Theme SHOULD BE live on https://www.law4veterans.com/va-claims-consultation,4,03/31/2025,,Medium,No Bucket,planner1,
TROY DO THIS SHIT - google ads,May 11 is Military Spouse Appreciation Day;Military Appreciation Month ,2,03/31/2025,,Medium,No Bucket,planner1,
[DB] FACEBOOK / META RESOURCES,"(Joe) no fee ""until we win"" vs ""unless we win""",1,04/08/2025,,Medium,Questions for emails,planner1,
audit /update L4V phone numbers,Law Firm ;legal service;Veterans services;legal ;Lawyer,5,03/31/2025,,Medium,Questions for emails,planner1,
competitors / inspo,lawyer vs attorney vs law firm;https://www.ncbar.org/2019/07/23/ethical-considerations-for-nc-law-firm-websites/,2,04/03/2025,,Medium,Questions for emails,planner1,
database ideas,asking for input before every step = nothing gets done,1,04/04/2025,,Medium,Questions for emails,planner1,
L4V v3.0 chatbot - intaker high level TO DO ,"is SMS a valid Lead contact method? ... include ""text me"" option on forms?;""most recent va decision letter"" ... do i need to clarify which letter? or clarify multiple is ok?;VA Decision Letter .... vs ratings decision? need an official glossary (SEO shit) ;joe does free consult 100% of the time? ;is the Wix Contact Form simple enough for LCD Leads? ;Is Nextiva your only biz number provider?;Sender identity in chatbots... initial messages from L4V or from Joe ?;please evaluate/correct consent box",8,04/18/2025,,Urgent,Questions for emails,planner1,
NEED L4V MEDIA FOR...,VA claims == va disability claims?,1,05/10/2025,,Medium,Questions for emails,planner1,
OPSEC,bochicchiolaw@gmail.com > intaker pending users;[pen test] joe@law4veterans and @DLH >> as username for gmail.com ;bochicchiolaw >> 2fa phone ends in -27.... >> j**@law4veterans.com;bochicchiolaw@gmail.com > google ads admin;law4veterans@gmail.com,5,03/31/2025,,Medium,Questions for emails,planner1,
Search Console link to backlinks,hashtags approval ;core identity claims;who can we tag in posts ,3,04/17/2025,,Medium,Questions for emails,planner1,
"[DB] L4V HASHTAGS (fb, ig) ",,,04/07/2025,,Medium,SOCIAL MEDIA,planner1,social media;[databases]
accounts and pages to tag,my current fb page login = bbdigital email + bakerb user account. disentangle this;https://www.reddit.com/r/FacebookBusiness/comments/1hagop5/unable_to_accept_business_invite/;meta account: disallow cross over logins;fb page admin accounts are tied to email address...;personal FB account cannot use Meta Business Suite ;fb page admin: change bbdigital to bakerb;facebook.com/id/hub > official docs > action required > 'no Q's available' loop;INFO: i have never used/installed FB mobile > incomplete 'identity' feature? > limiting my acct?,8,04/07/2025,,Medium,SOCIAL MEDIA,planner1,
Competitor,#JosephMBochicchioPLLC #GoWithJoe #Law4Veterans;#serviceconnected,2,04/20/2025,,Medium,SOCIAL MEDIA,planner1,social media;[databases]
FAQ page ,https://x.com/Law4veterans,1,04/04/2025,,Medium,SOCIAL MEDIA,planner1,
Finish website,"finish headshots, export finals;outlook;facebook business page;fb personal acct;ig business acct;yelp;gmail?;google business page / acct",8,03/31/2025,,Urgent,SOCIAL MEDIA,planner1,
Fix mobile layout,finish the easy-graphic for stella (finished? check email) ;start ads campaign;QR +UTM codes (decide on google analytics tags??) ,3,03/31/2025,,Medium,SOCIAL MEDIA,planner1,
google ads settings ,fb page admin: https://www.facebook.com/professional_dashboard/overview/;https://www.facebook.com/business/help/support;https://play.google.com/store/apps/developer?id=Meta%20Platforms%2C%20Inc.&hl=en_US;https://www.facebook.com/help,4,04/16/2025,,Medium,SOCIAL MEDIA,planner1,social media;[databases]
google tag mgr,wounded warrior project? etc;ask joe,2,04/16/2025,,Medium,SOCIAL MEDIA,planner1,
"ian, social media",,,03/31/2025,,Urgent,SOCIAL MEDIA,planner1,
L4V DIGITAL ASSET MAP ,reply to open FB tickets;claim fb@law4veterans;verify phone # tied to Joe IG profile > accountscenter.instagram.com/profiles/;UNLOCK INSTAGRAM?!?!?;open help via IG;Get meta verified ;Verify Joe personal identity (mail 2fa from Debbie) ;attach all accts to accountscenter.instagram.com  ;open addtl FB help,9,04/04/2025,,Medium,SOCIAL MEDIA,planner1,
Landing page??,"pfp;l4v business details;removed Jessica's logged-in device (macOS, nov 2022);sanitize follows/ers",4,03/31/2025,,Medium,SOCIAL MEDIA,planner1,
law4veterans.com/#burn,facebook;website;-4044 = Twilio (no access?);[“real” #s == 704-543-2294 and 704-940-0353];7045432294 - IG @joe_vets_lawyer;nc bar records,6,03/31/2025,,Medium,SOCIAL MEDIA,planner1,phone numbers #
Meta,https://portal.ncbar.gov/verification/search.aspx?ID=28244;https://www.va.gov/ogc/apps/accreditation/accredpeopledetail.asp?ID={40E3B201-2C42-4B1A-A19F-6FE3479,2,03/31/2025,,Medium,SOCIAL MEDIA,planner1,
Schema guideline to improve SEO,solution? https://www.youtube.com/watch?v=rMQRqKi4FeQ;(https://www.youtube.com/@Law4Veterans);recover account? ... law4veterans@gmail.com,3,04/07/2025,,Medium,SOCIAL MEDIA,planner1,
Troy's website,,,03/31/2025,,Medium,SOCIAL MEDIA,planner1,
web vs desktop apps,1300 folowers - https://www.instagram.com/ptsdlawyers/;4500 folowers - https://www.instagram.com/veteranslegalinstitute/;1200 followers - https://www.instagram.com/woodsandwoods/,3,04/07/2025,,Low,SOCIAL MEDIA,planner1,
wix font themes,,,04/28/2025,,Medium,SOCIAL MEDIA,planner1,
wix: prep for OUTSOURCE,saved here > https://keep.google.com/u/0/#label/%23%23L4V%20captions,1,04/28/2025,,Medium,SOCIAL MEDIA,planner1,
Brian Meta account disaster,"Fed/Mil holidays: instagram, facebook, email, sms??;Bday outreach: email, sms??",2,04/01/2025,,Medium,"TO DO, this week",planner1,
dba/trade name,"research: call rail, nextiva, twilio .. multi-number setup for analytics, campaigns ;brian: reply to Twilio email;Joe's 300-4VET new number?",3,04/01/2025,,Medium,"TO DO, this week",planner1,external help tickets;phone numbers #
DNS Domain auth keys are on Wix,"home grown NC;single lawyer;no AI (limit this claim);case/client selective;VA accredited atty;X hundred vets served;bank, BK attorney;one-on-one, human interaction;zero corporate;20 years of experience;20% fee;no jurisdiction limit;family practice",13,04/22/2025,,Medium,"TO DO, this week",planner1,social media;Joe
"get GAds under GA4, all under new marketing platform ",attach ad pixel(s) to website;fix google tag mgr,2,04/22/2025,,Medium,"TO DO, this week",planner1,
Joe's INTAKER reqs,"change PFPs (ig, fb) ;sanitize instagram (followed accounts) ",2,04/18/2025,,Urgent,"TO DO, this week",planner1,URGENT
Nexus Letter Providers,"send assets;add to IG, FB admin;work on twitter, linkedin, ;https://metricool.com/crossposting-instagram-facebook/#Crossposting_from_Instagram_to_Facebook_from_;(Ian) does his account work? ;https://help.instagram.com/192857082456744;ask his content/design ;ian posts to IG > auto-post to FB page",8,04/18/2025,,Important,"TO DO, this week",planner1,TODO this wk;URGENT;social media
psych doc search,review joe's fwd ;review new DS tiers;schedule Docusign demo (Maestro)  ;date: TBD,4,03/31/2025,,Urgent,"TO DO, this week",planner1,
social media,GOOGLE analytics;IG / FB  admin;WEBDEV (wix);IG post creation / management;Katie Todd?;Eileen;Boran;Kate cygan?;Katie Koenig,9,04/08/2025,,Important,"TO DO, this week",planner1,
wix themes,"MD or PhD ... see joe email for reqs;compile list, send to joe ;(wix form) Alex Rosin, MD ALEXROSIN4@GMAIL.COM https://www.linkedin.com/in/alex-rosin-072ba1321;https://www.reddit.com/r/psychotherapists/comments/1iyu0as/where_to_find_clients/;search web, IG, FB, psych today, linkedin, ... VA website? ",5,04/28/2025,,Medium,"TO DO, this week",planner1,
[DB] LIST OF PHONE NUMBERS ,Awaiting exam instructions from Stella;What else needed for e-exam?,2,04/08/2025,,Medium,upcoming,planner1,
Biz category,"outlook inbox search: ""unsubscribe"";open support ticket: when was rule ""antispam"" created? > matthewdonchester2023@gmail.com;segregate email addresses.. biz and personal;remember Stella's bitwarden password....;set up bitwarden for Joe and Stella....;Set brian as their bitwarden admin",6,04/01/2025,,Medium,upcoming,planner1,
Can Joe access....?,"Create a data breach plan, and disaster recovery plan/ business continuity;Ask Scott if Cybersecurity for the firm is within his scope ;Teach staff about email encryption",3,03/31/2025,,Medium,upcoming,planner1,
"clean up L4V canva folders, permissions","SHOOTING PICS w/Sam;g photos - jeep, NC, https://photos.app.goo.gl/APg5pXWnmUGCkcFr9",2,04/07/2025,,Low,upcoming,planner1,WIX SHIT
"draft Firm-wide ""how to not get hacked"" email ",alh ? ,1,04/15/2025,,Medium,upcoming,planner1,
generate QR + UTM ,mil holidays ;holidays;bdays,3,03/31/2025,,Medium,upcoming,planner1,URGENT;campaigns
Meta Ads policy - fb/ig,https://www.wix.com/tools/qr-code-generator;figure out UTM tags > google analytics,2,04/07/2025,,Medium,upcoming,planner1,
Wix Boards,"password to passphrase ;""unsubscribe"";how to examine outlook email header?/detailed sender info (SENDER DOMAIN) ",3,04/28/2025,,Medium,upcoming,planner1,
" reasons ""why we're different""",final edits (color temp) ;best export settings?,2,04/04/2025,,Important,URGENT - DO THIS NOW,planner1,
Brian notes re: fiverr wix site,,,04/28/2025,,Medium,URGENT - DO THIS NOW,planner1,
edit domain config for tag,,,04/17/2025,,Medium,URGENT - DO THIS NOW,planner1,
EDIT PICS FOR WEBSITE,attach ad accounts to biz portfolios + assets (both L4v and bbdigital);Separate ig and FB logins (meta accounts panel);Try allowing all cross logins for Brian accounts to access meta biz suite? Try adding individually;Check Joe biz suite admins.... Add both my accounts (bakerb/fb and bbdigital/ig);RESEARCH: meta work account?? Account assigned by admin;Add 2fa sms # to personal acct?,6,04/08/2025,,Medium,URGENT - DO THIS NOW,planner1,URGENT;social media
Email campaign calendar,does moving OFF front page help? ... ask support ;captcha is active in settings. does it need to be added as form element?;See help ticket reply: bbdigital inbox,3,04/06/2025,,Urgent,URGENT - DO THIS NOW,planner1,external help tickets
