# GH ISSUE TITLE,"# BODY STRING  (SUB-ISSUES, semi-colon delimited)",# TOTAL SUB-ISSUES,# CREATED,# COMPLETED,# PRIORITY,# LABEL1,# LABEL2,# LABEL3 - LABELn (semi-colon delimited)
Finish installing Google Tags to Tag Manager and Analytics,"(unless that's a google search console bug?? idr. double check) ;install Vibe pixel (see their support article) ;google tag manager show TWO l4v websites... maybe due to ""ghost"" header tag html? ;fix google tag manager;https://support.google.com/tagmanager/answer/12329709",5,04/16/2025,,Medium,URGENT - DO THIS NOW,planner1,
google ads TO DO ,conversion tracker on form? pages? lander?  ;install intaker?;https://support.google.com/google-ads/answer/12215519?sjid=2230791702719779702-NC#zippy=%2Cin-google;SCHEDULE MEETING;requires google tag manager,5,03/31/2025,,Medium,URGENT - DO THIS NOW,planner1,
google tag mgr,"use ""OLD FORM"" for inbox reply-to-Lead fxn (ARTICLE ABOVE);Wix email notif:   ""From: Joe Bochicchio | Law4Veterans.com"" ... remove Joe B;change pfp to Joe or L4V logo?",3,03/31/2025,,Urgent,URGENT - DO THIS NOW,planner1,WIX SHIT;intaker
"Joe bona fides, acolades",IG (1080 x 1350):  4:5 portrait... 1080p width,1,04/04/2025,,Medium,URGENT - DO THIS NOW,planner1,
Joe Qs: social media usage,"r1) open with branding? jeep, dogtag?, logo??;r2) (PIN) about joe, about l4v, why we're different;2) contact info (use ig app);3) l4v generic (use meta app)",4,04/07/2025,,Medium,URGENT - DO THIS NOW,planner1,URGENT;social media
L4v accounts /profiles,email debbie;receive > enter code via joe's personal fb account;RECEIVED: BBDIGITAL INBOX FOR CODE,3,04/04/2025,,Medium,URGENT - DO THIS NOW,planner1,
L4V CORE BRANDING,"Brian cannot access Meta Business Suite using his personal login (bakerb4379)

🐊: fixed it?!??? enabled all accounts cross-login, then (personal) meta verified. not sure what did it",,04/07/2025,,Medium,URGENT - DO THIS NOW,planner1,
L4V Email blue check (in Gmail) ,"remove wix chat ;install intaker;set joe as reply-to? ;write submission page instructions > /va-claim-consultation;final intaker script edits, profile pic, etc.;------;standalone chat == landing page?? /lander;move contact form off first page and have buttons direct to /contact-us (was /contact-law4veterans?);------;pageload == form submission;-------;joe can reply to Lead by replying to the email (GOOD SHIT) == same as intaker;use as trigger to fire conversion action in troy's G.ADS CAMPAIGN ;change to OLD FORM and activate ""email only"" notifs ;optimize mobile ",15,04/03/2025,,Medium,URGENT - DO THIS NOW,planner1,
scrape copy from old websites,how to check VA letters.. https://news.va.gov/116268/view-download-va-decision-letters-online/; va letters explained https://cck-law.com/veterans-law/types-of-va-decision-letters-explained,2,03/31/2025,,Medium,URGENT - DO THIS NOW,planner1,WIX SHIT
website sprint ,,,04/17/2025,,Urgent,URGENT - DO THIS NOW,planner1,
youtube,"edit mobile site for 3XXpx wide (look this up)... audit with browser inspection>mobile, not wix prvw;background asset does not move, so.... ""prebake"" the ~translucent blue onto the background image??;change fonts to 13pt+?  - https://forum.wixstudio.com/t/having-a-page-zoom-out-on-mobile/41668/3;reconfigure hamburger menu (remove?) ;https://support.wix.com/en/article/accessibility-about-zoomed-content;decrease font sizes - https://support.wix.com/en/article/mobile-live-site-loads-zoomed-inout-on-andr;buttons link to external URL instead of site location - https://www.reddit.com/r/WIX/comments/tax9t1;hard code viewport - https://www.reddit.com/r/webdev/comments/vp28k8/comment/ieginbe/;MAYBE THIS IS TIED TO WEBSITE ""BACKGROUND COLOR"" ELEMENTS?? scrolling the page = color layers moving",9,03/31/2025,,Medium,URGENT - DO THIS NOW,planner1,
"google analytics, old setup ",UTM / QR: qr directly to landing page? ;Landing page background == submission instructions;attach to standalone URL  (law4veterans.com/lander?) ;TAG MANAGER: update trigger to.... page action? (inspect page log during form submit) ;customize Intaker landing page,5,04/16/2025,,Medium,week of RIGHT NOW (!!!)... in active progress,Planner2,
IG changes,NEW go with joe silhouette logo? ;new address;current phone number... ;QR code + UTM ... to intaker landing page? ,4,04/01/2025,,Medium,week of RIGHT NOW (!!!)... in active progress,Planner2,
"Legal disclaimers, policy","Email rule found;L4v email security, user opsec;Meta verified.. Notarized form required;Meta ads",4,04/04/2025,,Medium,week of RIGHT NOW (!!!)... in active progress,Planner2,
RESEARCH: website Badges?? shit to join???,"Google tags;Intaker edits.... Help refine the submissions (up lead quality);Determine referral sources (link analytics + ads);WhatsApp ads;Reddit ads;Qr code  +utm campaign;Google analytics;L4V Ai dev: competitor research, analyze ads data for keywords, ad copy,;Phone numbers;Interviewing candidates, boran, dony;Google business (+ reviews);Email campaigns (tied to simplelaw crm);Archive old sites, cancel hostgator;TV commercial thing;Further thoughts on Ai;New crm in dev;Ad campaigns... Huge room for improvement;Psych eval referrals;Ai seo??? Have been pivoting to it",19,04/04/2025,,Medium,week of RIGHT NOW (!!!)... in active progress,Planner2,
Biz card 2025,"g photos - headshots; proofs, https://photos.app.goo.gl/yCDJkxfoR6G8TLDu8;gdrive - assets for Ian (headshots, logos)  ;gdrive - canva exports (socials posts) ;canva - socials posts;g photos - jeep, NC, https://photos.app.goo.gl/APg5pXWnmUGCkcFr9;Headshots draft edit v1 vhttps://photos.app.goo.gl/yCDJkxfoR6G8TLDu8",6,06/17/2025,,Medium,WIX WEBSITE,planner1,[databases];WIX SHIT;L4V Branding
create L4V roles/users/aliases (m365),website flashes and reloads on my phone (adguard);test intaker bot v2,2,04/01/2025,,Medium,WIX WEBSITE,planner1,
create shared GPT account for [org],,,04/16/2025,,Medium,WIX WEBSITE,planner1,
Email,https://support.wix.com/en/article/wix-editor-working-with-text-themes,1,06/17/2025,,Urgent,WIX WEBSITE,planner1,
Email 2,"INTEGRATIONS: G tag vs tag mgr? ;SEO: meta tags for literally every element, asset filenames (native vs wix?) ;fix mobile layout menus;ASSETS: edit pics, logos;MENUS: mobile and desktop;fix mobile layout zoom issue;https://www.reddit.com/r/WIX/comments/17s9x2y/best_practices_uploading_images_and_saving_records/;apply joe intaker edits;shrink mobile layout elements;fix mobile layout font size;install intaker;INTAKER: request joe audit;MOBILE SITE: fix layout;CONTENT: faqs... ;Update website socials info/icons",15,06/17/2025,,Urgent,WIX WEBSITE,planner1,WIX SHIT
intaker Qs for Joe,https://support.wix.com/en/article/wix-editor-troubleshooting-layout-issues-on-your-mobile-site;https://support.wix.com/en/article/site-performance-best-practices,2,03/31/2025,,Medium,WIX WEBSITE,planner1,
intaker v3.0.. landing page setup,"""not legal advice"" per page, per FAQ article;any others reqd?;privacy policy?;geo service area (good for SEO and stupids) ",4,06/17/2025,,Medium,WIX WEBSITE,planner1,
Qs for Joe ,,,03/31/2025,,Medium,WIX WEBSITE,planner1,
research stubs,website zooms in for certain users (android + chrome?) ,1,05/06/2025,,Medium,WIX WEBSITE,planner1,
scrape archived L4V sites (wayback machine),https://support.wix.com/en/article/site-performance-optimizing-your-media;https://support.wix.com/en/article/wix-media-supported-media-file-types-and-file-sizes;image formatting tool ... https://squoosh.app/;https://support.wix.com/en/article/optimizing-your-images-and-galleries-for-seo-alt-text;https://forum.wixstudio.com/t/is-anyone-already-using-avif-images-on-wix/65121,5,03/31/2025,,Medium,WIX WEBSITE,planner1,
where update joe prof pics?,https://www.wix.com/blog/responsive-website-design,1,04/01/2025,,Low,WIX WEBSITE,planner1,
🧞: Conduct Cybersecurity Audit,,,04/08/2025,,Medium,WIX WEBSITE,planner1,
